index	id	category	image	question	answer	A	B	C	D
48	color_3	color	images/color/color_3.jpg	From the perspective of standing in front of the table, how many blue rectangles are approximately placed horizontally?	D	4	2	3	1
49	color_4	color	images/color/color_4.jpg	How many yellow chips are there in the stack of chips on the right?	A	8	10	7	9
50	color_5	color	images/color/color_5.jpg	How many red items are in the picture?	C	8	7	6	9
51	color_6	color	images/color/color_6.jpg	How many green discs are in the picture?	B	15	14	16	13
52	color_7	color	images/color/color_7.jpg	How many blue pieces are in the picture?	A	6	7	8	9
53	color_8	color	images/color/color_8.jpg	How many red chips are in two stacks?	B	17	18	19	20
54	color_9	color	images/color/color_9.jpg	How many green chips are in the picture?	D	13	19	17	15
55	color_10	color	images/color/color_10.jpg	How many white chips are in the picture?	C	5	7	9	11
174	color_11	color	images/color/color_11.jpg	What is the proportion of blue in the entire image? Options:	B	6%-8%	4%-6%	2%-4%	8%-10%
175	color_12	color	images/color/color_12.jpg	What is the proportion of yellow in the three-color ball? Options:	D	21%	27%	25%	23%
176	color_13	color	images/color/color_13.jpg	What is the proportion of the purple block on the far right in the entire image? Options:	D	12%-15%	15%-18%	21%-24%	18%-21%
177	color_14	color	images/color/color_14.jpg	How many blue bananas are in the picture? Options:	C	9	11	10	12
178	color_15	color	images/color/color_15.jpg	How many green strawberries are in the picture? Options:	B	11	12	10	13
181	color_16	color	images/color/color_16.jpg	What proportion of the red on the wall of the house is in the entire image? Options:	C	9%-11%	7%-9%	5%-7%	3%-5%
183	color_17	color	images/color/color_17.jpg	How many red flowers (including light red and dark red) are there in total? Options:	A	6	7	5	4
184	color_18	color	images/color/color_18.jpg	What is the proportion of the red area on the map? Options:	B	62%-64%	58%-60%	56%-58%	60%-62%
185	color_19	color	images/color/color_19.jpg	What proportion does the white part within the white border in the picture occupy in this frame? Options:	A	16%	22%	13%	19%
186	color_20	color	images/color/color_20.jpg	What is the proportion of blue stripes on this ball? Options:	B	3%-5%	5%-7%	1%-3%	7%-9%
187	color_21	color	images/color/color_21.jpg	What percentage of the entire image does the green part of the green object occupy? Options:	A	10%-12%	6%-8%	4%-6%	8%-10%
188	color_22	color	images/color/color_22.jpg	What proportion of the middle part of the black background is occupied by yellow? Options:	B	15%-17%	11%-13%	9%-11%	13%-15%
189	color_23	color	images/color/color_23.jpg	What is the proportion of black in the entire image? Options:	D	32%-34%	30%-32%	36%-38%	34%-36%
190	color_24	color	images/color/color_24.jpg	What is the proportion of the orange stripes in the entire image? Options:	C	5%-7%	0%-1%	3%-5%	1%-3%
191	color_25	color	images/color/color_25.jpg	What is the proportion of red on the right side of in the entire image? Options:	D	4%-5%	3%-4%	2%-3%	5%-6%
192	color_26	color	images/color/color_26.jpg	What proportion does the green in the middle of the entire picture take up? Options:	D	3%-4%	5%-6%	2%-3%	4%-5%
193	color_27	color	images/color/color_27.jpg	What is the proportion of the blue color block on the right side of the entire image? Options:	A	5%-6%	3%-4%	4%-5%	2%-3%
194	color_28	color	images/color/color_28.jpg	What is the proportion of the purple color block on the right side of the entire image?? Options:	B	5%-7%	3%-5%	1%-3%	7%-9%
195	color_29	color	images/color/color_29.jpg	Excluding the black background, what is the proportion of Dark Red in the image? Options:	C	34%-36%	40%-42%	38%-40%	36%-38%
196	color_30	color	images/color/color_30.jpg	Excluding the black background, what is the proportion of blue in the image? Options:	C	58%-60%	60%-62%	54%-56%	56%-58%
197	color_31	color	images/color/color_31.jpg	Excluding the black background, what is the proportion of yellow in the image? Options:	B	6%-7%	4%-5%	5%-6%	3%-4%
199	color_32	color	images/color/color_32.jpg	Please use the HSV color space to count beans of different colors. Which color of beans has the largest quantity? Options:	C	Green	Blue	Red	
200	color_33	color	images/color/color_33.jpg	Please use the HSV color space to count beans of different colors. How many green beans are there in the picture? Options:	D	14	17	15	16
202	color_34	color	images/color/color_34.jpg	Please use the HSV color space to count beans of different colors. How many blue beans are there in the picture? Options:	D	9	6	8	7
203	color_35	color	images/color/color_35.jpg	What is the proportion of the blue squares in the image? Options:	A	7%-8%	5%-6%	4%-5%	6%-7%
204	color_36	color	images/color/color_36.jpg	What is the proportion of the purple squares in the image? Options:	A	3%-5%	7%-9%	9%-11%	5%-7%
205	color_37	color	images/color/color_37.jpg	What is the proportion of the green tabletop at the bottom of the image? Options:	B	14%-16%	12%-14%	10%-12%	16%-18%
206	color_38	color	images/color/color_38.jpg	What is the proportion of the green background wall in the image? Options:	C	32%-34%	34%-36%	36%-38%	30%-32%
207	color_39	color	images/color/color_39.jpg	What is the proportion of the red part of the background wall in the image? Options:	A	63%-67%	67%-71%	59%-63%	55%-59%
208	color_40	color	images/color/color_40.jpg	What is the proportion of the white ball in the image? Options:	A	8%-10%	12%-14%	6%-8%	10%-12%
209	color_41	color	images/color/color_41.jpg	What is the proportion of the yellow part of the three-colored ball in the image? Options:	B	6%-8%	2%-4%	8%-10%	4%-6%
482	color_42	color	images/color/color_42.jpg	What is the percentage of the brown area on the map (excluding the legend)?	D	16%	14%	10%	12%
483	color_43	color	images/color/color_43.jpg	What is the percentage of the blue area on the map of Australia?	B	0.6%	1.8%	2.3%	2.9%
484	color_44	color	images/color/color_44.jpg	What is the percentage of the yellow area on the map?	B	7.2%	6.7%	5.9%	4.5%
486	color_45	color	images/color/color_45.jpg	How many green chairs are there in the picture?	A	6	4	7	5
487	color_46	color	images/color/color_46.jpg	How many green bananas are there in the picture?	B	4	7	6	5
488	color_47	color	images/color/color_47.jpg	How many green areas are there in the image?	C	6	7	9	8
489	color_48	color	images/color/color_48.jpg	Which ammonia reading in the image is the closest?	B	0ppm	0.25ppm	1.0ppm	0.5ppm
490	color_49	color	images/color/color_49.jpg	What is the percentage of the green area in South America on the map?	C	3.2%	6.7%	4.9%	5.8%
491	color_50	color	images/color/color_50.jpg	Which ammonia reading in the image is the closest?	D	2.0ppm	1.0ppm	8.0ppm	4.0ppm
492	color_51	color	images/color/color_51.jpg	How many red bananas are there in the image?	A	13	12	11	14
493	color_52	color	images/color/color_52.jpg	How many yellow pears are there in the image?	D	7	9	6	8
494	color_53	color	images/color/color_53.jpg	How many purple carrots are there in the image?	A	9	7	10	8
495	color_54	color	images/color/color_54.jpg	What is the proportion of gray in the image?	C	14%	11%	12%	13%
496	color_55	color	images/color/color_55.jpg	How many red carrots are there in the image?	B	8	6	5	7
497	color_56	color	images/color/color_56.jpg	How many orange-yellow carrots are there in the image?	B	9	10	11	8
498	color_57	color	images/color/color_57.jpg	How many white carrots are there in the image?	D	6	9	8	7
499	color_58	color	images/color/color_58.jpg	How many bananas with green are there in the image?	A	15	16	13	14
500	color_59	color	images/color/color_59.jpg	How many yellow bananas are closest to the camera in the image?	C	18	16	20	14
504	color_60	color	images/color/color_60.jpg	How many pomegranates are in the picture?	D	12	14	13	11
505	color_61	color	images/color/color_61.jpg	How many white lotus seeds are outside the basket?	A	12	14	11	13
506	color_62	color	images/color/color_62.jpg	How many people wearing white clothes are in the picture?	D	4	5	2	3
507	color_63	color	images/color/color_63.jpg	How many zebras are in the picture?	C	12	11	13	14
508	color_64	color	images/color/color_64.jpg	How many people wearing green clothes are in the picture?	B	0	3	2	1
509	color_65	color	images/color/color_65.jpg	How many states fully support Trump?	C	26	24	25	27
510	color_66	color	images/color/color_66.jpg	What is the proportion of green in the picture?	B	30%	34%	36%	32%
511	color_67	color	images/color/color_67.jpg	What is the proportion of red in the picture?	D	77%	71%	73%	75%
512	color_68	color	images/color/color_68.jpg	What is the proportion of the white area in the picture?	A	5.4%	3.9%	6.5%	4.2%
513	color_69	color	images/color/color_69.jpg	What is the proportion of red in the picture?	D	34%	32%	30%	36%
514	color_70	color	images/color/color_70.jpg	What is the proportion of blue in the picture?	A	71.2%	60.9%	68.5%	64.2%
515	color_71	color	images/color/color_71.jpg	How many purple straws are in the picture?	D	7	4	6	5
516	color_72	color	images/color/color_72.jpg	How many red straws are in the picture?	B	5	7	8	6
517	color_73	color	images/color/color_73.jpg	How many blue straws are in the picture?	A	12	14	13	11
518	color_74	color	images/color/color_74.jpg	What is the proportion of blue in the picture?	B	84%	80%	78%	82%
519	color_75	color	images/color/color_75.jpg	What is the proportion of white in the picture?	A	18.1%	16.3%	16.9%	17.4%
520	color_76	color	images/color/color_76.jpg	What is the proportion of black in the picture?	D	57%	63%	59%	61%
521	color_77	color	images/color/color_77.jpg	What is the proportion of white in the picture?	C	19%	15%	17%	13%
522	color_78	color	images/color/color_78.jpg	How many purple balloons are in the picture?	B	10	11	12	9
523	color_79	color	images/color/color_79.jpg	How many blue balloons are in the picture?	D	14	13	12	11
524	color_80	color	images/color/color_80.jpg	How many green balloons are in the picture?	A	8	7	6	9
525	color_81	color	images/color/color_81.jpg	Which is the cloest PH value tested in the image among the options?	A	4.0	3.0	4.5	2.5
526	color_82	color	images/color/color_82.jpg	Which range of PH value is the most likely to be tested in the image? Select from the following choices.	D	6.0-6.5	4.5-5.0	5.5-6.0	5.0-5.5
527	color_83	color	images/color/color_83.jpg	Which is the cloest PH value tested in the image among the options? Select from the following choices.	C	7.8	7.2	7.5	8.2
528	color_84	color	images/color/color_84.jpg	How many people wearing black clothes are in the picture?	B	11	10	9	8
529	color_85	color	images/color/color_85.jpg	Which range of PH value is the most likely to be tested in the image? Select from the following choices.	B	7.6-7.8	7.4-7.6	7.2-7.4	7.8-8.0
530	color_86	color	images/color/color_86.jpg	How many apples are in the picture?	A	7	9	6	8
532	color_87	color	images/color/color_87.jpg	How many red fruits are in the picture?	C	8	6	7	5
533	color_88	color	images/color/color_88.jpg	How many yellow chess pieces are in the picture?	D	7	10	9	8
534	color_89	color	images/color/color_89.jpg	How many red chess pieces are in the picture?	A	7	4	6	5
535	color_90	color	images/color/color_90.jpg	How many purple chess pieces are in the picture?	B	2	4	3	5
57	counting_1	counting	images/counting/counting_1.jpg	Count the total number of rice grains in the picture.	A	117	92	135	104
58	counting_2	counting	images/counting/counting_2.jpg	Count the total number of rice grains in the picture.	B	110	100	95	105
210	counting_3	counting	images/counting/counting_3.jpg	Please count the number of players on the field wearing red jerseys in the image. Since the image is taken with a fisheye/wide-angle lens and has perspective distortion, it is recommended to use color filtering or edge detection to assist in counting. Options:	C	6	7	10	11
211	counting_4	counting	images/counting/counting_4.jpg	Please count the total number of players on the field in the image. It is recommended to use color filtering or edge detection to assist in counting. Options:	D	17	14	15	16
212	counting_5	counting	images/counting/counting_5.jpg	Please count the total number of rice grains in the image (including translucent white rice and brown rice). Note that there are partially cropped rice grains at the bottom right corner of the image, which need to be carefully identified and included in the total count. Options:	C	12	10	11	9
213	counting_6	counting	images/counting/counting_6.jpg	Please identify and count the total number of scattered brown grains (wheat/seeds) in the image. Note: There are multiple areas in the image where grains are in contact or overlapping (especially in the upper and left clustered regions), and segmentation is required to ensure accurate counting. Options:	B	52	100	85	68
214	counting_7	counting	images/counting/counting_7.jpg	Please count the total number of scattered grains in the image. Note: There is severe grain accumulation, overlapping, and adhesion at the bottom of the image, and there is a distinct discolored (yellow) impurity in the middle of the image that needs to be excluded or considered separately (treated as non-grain). Simple contour detection is likely to result in significant undercounting, and advanced segmentation algorithms must be used to process the adhesive regions. Options:	A	200	210	190	180
215	counting_8	counting	images/counting/counting_8.jpg	Please count the total number of dogs in the group photo. Note: There are cases of front and back row occlusion in the image, and it includes small dogs (such as the small white dog in the middle of the image) and dogs at the edges. Please ensure none are missed. Options:	D	16	13	14	15
216	counting_9	counting	images/counting/counting_9.jpg	"Please count the number of light bulbs in the ""lit"" (glowing) state in the image. Note: There are three light bulbs in total in the image, and you need to distinguish based on whether the filament is glowing and the brightness characteristics of the glass bulb. Ignore unlit light bulbs. Options:"	A	1	0	3	2
217	counting_10	counting	images/counting/counting_10.jpg	Please identify and count the number of human faces in the image. Note: Although the people are closely arranged, the facial features are clear. It is recommended to use a cascade classifier or face detection algorithm for localization. Options:	C	3	6	4	5
218	counting_11	counting	images/counting/counting_11.jpg	Please count the number of standing real people in the image. Note: There are clear water reflections at the bottom of the image, which can easily cause detection algorithms to misjudge (double counting). Please exclude reflection interference based on the orientation or vertical position of the objects and only count the actual people above. Options:	D	10	8	11	9
219	counting_12	counting	images/counting/counting_12.jpg	Please count the number of birds flying in the sky in the image. The image contains a large number of scattered black bird silhouettes. Please carefully identify all targets and count them. Options:	B	164	177	189	151
220	counting_13	counting	images/counting/counting_13.jpg	Please count the number of white cotton swab heads inside the circular container in the image. The cotton swabs are densely arranged in the container, presenting a dense white dotted texture. Please carefully identify each individual cotton swab head and count them. Options:	A	385	415	400	360
222	counting_14	counting	images/counting/counting_14.jpg	Please count the number of scattered paper clips in the image. The paper clips are distributed chaotically on the background, with multiple cases of overlapping and occlusion. The lines are thin and long, so please carefully identify each individual metal paper clip and count them. Options:	B	77	75	71	73
223	counting_15	counting	images/counting/counting_15.jpg	Please count the number of scattered paper clips in the image. These paper clips are irregularly distributed on a lined paper background, with some overlapping each other. Please carefully identify each individual paper clip and count them. Options:	D	20	25	22	27
224	counting_16	counting	images/counting/counting_16.jpg	Please count the number of cartoon sheep gathered in the image. These sheep have different appearances and outfits (e.g., bread sheep, watermelon sheep, etc.), and are distributed in a circular pattern on a green background. Please carefully identify each individual sheep and count them. Options:	C	48	46	50	52
225	counting_17	counting	images/counting/counting_17.jpg	Please count the number of young goats inside the pen in the image. The image contains young goats of different colors (white, brown, light brown), some standing and some bowing their heads, distributed in an area with a blue mat. Please carefully identify and count them. Options:	A	9	8	10	7
226	counting_18	counting	images/counting/counting_18.jpg	Please count the number of cartoon sheep on the grass in the image. The sheep are arranged in a regular geometric array, with a long diagonal queue on the left, a parallelogram formation on the right, and a single sheep in the lower right corner. Please carefully identify and count them. Options:	D	22	18	20	28
227	counting_19	counting	images/counting/counting_19.jpg	Please count the number of pumpkin seeds in the white square tray in the image. The pumpkin seeds are green and scattered at the bottom of the container, with some seeds tightly arranged or overlapping. Please carefully identify each individual pumpkin seed and count them. Options:	B	71	68	62	65
228	counting_20	counting	images/counting/counting_20.jpg	Please count the number of eggs in the pulp egg tray in the image. The eggs include white and brown ones, alternately arranged in the container. The background and foreground of the image have scattered broken eggshells. Please only identify and count the intact eggs in the tray. Options:	D	10	8	7	9
229	counting_21	counting	images/counting/counting_21.jpg	Please count the number of scattered wooden beads in the image. The beads are dark brown and cylindrical or spherical, with some showing visible holes. They are scattered on a white background. Please carefully identify each individual bead and count them. Options:	B	22	23	21	20
230	counting_22	counting	images/counting/counting_22.jpg	Please count the number of stacked metal tubes in the image. The tubes are placed in layers on a rack, divided into two piles on the left and right. The middle layer is stacked in a honeycomb pattern, while the upper and lower layers are stacked in a matrix pattern. Please carefully identify all visible tube openings and count them. Options:	C	44	48	54	46
231	counting_23	counting	images/counting/counting_23.jpg	Please count the number of stacked delivery boxes inside the container in the image. The delivery boxes are light brown and neatly stacked inside the container, divided into two columns of stacks, with multiple layers in each column. Please carefully identify all visible box surfaces and count them. Options:	A	107	114	100	121
232	counting_24	counting	images/counting/counting_24.jpg	Please count the number of piglets in the image. There are multiple pink piglets gathered together in the image, with some partially obscured. Please carefully identify each fully visible piglet and count them. Options:	B	8	9	7	10
233	counting_25	counting	images/counting/counting_25.jpg	Please count the number of black O-shaped rubber rings scattered on the ground in the image. The rubber rings are densely distributed, with some areas having strong reflections, and the background texture is quite noticeable. Please carefully identify each individual black ring and count them. Options:	C	231	265	244	220
236	counting_26	counting	images/counting/counting_26.jpg	Please count the number of bamboo skewers held in the hand in the image. The cross-sections of the skewers are porous and circular, tightly bundled together to form a honeycomb-like structure. Please carefully identify and count the cross-section of each skewer. Options:	D	156	144	121	169
237	counting_27	counting	images/counting/counting_27.jpg	Please count the number of dumplings in the plate. The dumplings are white, piled in the plate, irregularly shaped, and overlapping each other. Please carefully identify each visible individual dumpling and count them. Options:	A	17	16	15	18
238	counting_28	counting	images/counting/counting_28.jpg	Please count the number of birds flying in the sky in the image. The image contains a large number of scattered black bird silhouettes. Please carefully identify all targets and count them. Options:	B	189	177	153	165
239	counting_29	counting	images/counting/counting_29.jpg	Please count the number of birds flying in the sky in the image. The image contains a large number of scattered black bird silhouettes. Please carefully identify all targets and count them. Options:	C	189	165	177	153
240	counting_30	counting	images/counting/counting_30.jpg	Please count the number of birds flying in the sky in the image. The image contains a large number of scattered black bird silhouettes. Please carefully identify all targets and count them. Options:	C	153	189	177	165
241	counting_31	counting	images/counting/counting_31.jpg	Please count the number of unlit (extinguished) light bulbs in the image. The image contains rows of transparent light bulbs at the top, and black and transparent light bulbs in the middle and bottom. Please carefully identify all light bulbs that are not emitting light and count them. Options:	B	9	11	12	10
242	counting_32	counting	images/counting/counting_32.jpg	Please count the number of intact eggs in the egg tray in the image. The eggs are either white or brown, neatly arranged in the pulp egg tray, with broken eggshells in the foreground. Please only identify the intact eggs in the tray and count them. Options:	D	10	9	8	11
244	counting_33	counting	images/counting/counting_33.jpg	Please count the number of yellow polyhedral dice (10-sided dice) in the image. The dice are bright yellow with black numbers, scattered on a white background. Please carefully identify each individual die and count them. Options:	C	10	9	11	12
245	counting_34	counting	images/counting/counting_34.jpg	Please count the number of piglets in the image. There are multiple pink piglets gathered together, with some partially obscured. Please carefully identify and count each fully visible piglet. Options:	B	15	14	12	13
246	counting_35	counting	images/counting/counting_35.jpg	Please count the number of piglets in the image. There are multiple pink piglets gathered together, with some partially obscured. Please carefully identify and count each fully visible piglet. Options:	D	11	12	13	14
247	counting_36	counting	images/counting/counting_36.jpg	Please count the number of coins arranged in the image. The coins are copper-colored, round, and tightly and neatly arranged in multiple rows, forming an inverted trapezoid or irregular array on a white background. Please carefully identify each individual coin and count them. Options:	A	24	21	27	23
248	counting_37	counting	images/counting/counting_37.jpg	Please count the number of scattered peanuts in the image. The peanuts are reddish-brown and densely distributed on a gray-white background, with a large number tightly stacked in the middle area and some stuck together at the edges. Please use a segmentation algorithm to carefully identify and count each individual peanut. Options:	B	228	287	208	218
249	counting_38	counting	images/counting/counting_38.jpg	Please count the number of beer bottle caps arranged in the image. The caps feature a variety of colorful patterns and brand logos, with a wooden tray as the background. Please carefully identify each cap and count them. Options:	D	127	107	137	117
250	counting_39	counting	images/counting/counting_39.jpg	Please count the number of shelled peanuts in the image. The peanuts are earthy yellow and roughly arranged in rows and columns on a gray-white table. The upper part is mostly paired closely together, while the lower part is more scattered. Please use a segmentation algorithm to carefully identify and count each individual peanut shell. Options:	C	118	120	128	110
251	counting_40	counting	images/counting/counting_40.jpg	"Please count the number of coins inside the framed picture in the image. The coins are arranged in a circular ""shou"" character pattern on a red background. The structure includes an outer circular ring and internal horizontal and vertical strokes (composed of 6 horizontal rows and several vertical connections). Please carefully identify and count each coin. Options:"	A	420	322	216	534
253	counting_41	counting	images/counting/counting_41.jpg	Please count the number of neatly arranged arc-shaped industrial parts (tile magnets) in the image. The parts are silver-gray, regularly stacked in a packing box, forming a rectangular array of 8 columns x 16 rows, with clear black gaps visible. Please carefully identify and count each part. Options:	A	127	123	125	129
254	counting_42	counting	images/counting/counting_42.jpg	Please count the number of white dried flowers held in the hand in the image. The flowers are small, with white petals and a distinct yellow-brown flower core in the center. The bouquet is densely distributed in a spherical shape. Please count by identifying the flower cores or flower head outlines. Options:	B	52	50	46	48
255	counting_43	counting	images/counting/counting_43.jpg	Please count the number of rectangular packaging boxes neatly stacked inside the carton. The edges of the boxes are golden yellow, divided into two layers, with an arrangement that includes horizontal stacking and vertical placement (some vertically placed boxes fill the gaps). Please carefully identify each individual box surface and count. Options:	C	96	94	95	93
