index	id	category	image	question	answer	A	B	C	D
256	counting_44	counting	images/counting/counting_44.jpg	Please count the number of red and white capsules scattered inside the tray. The capsules are densely piled, with overlapping and adhesion in some areas. The background is light-colored. Please carefully identify each individual red and white capsule and count. Options:	C	282	319	303	290
257	counting_45	counting	images/counting/counting_45.jpg	Please count the number of books displayed on the bookshelf. The bookshelf has three layers, and the books are vertically and tightly arranged. The spines of the books vary in color and thickness (e.g., the middle layer has a set of green-covered books). Please count by identifying the edges of each book spine. Options:	D	70	59	61	68
657	counting_46	counting	images/counting/counting_46.jpg	This image shows a group of baby giant pandas arranged in rows on a completely black background. The pandas have characteristic black and white fur with black patches around their eyes, ears, and limbs. They are lying in various relaxed poses, and some are partially overlapping or touching each other. How many pandas are in this image?	C	28	18	23	15
659	counting_47	counting	images/counting/counting_47.jpg	Please check all the intersections (crossing points) on this chessboard and calculate the total number.	B	210	224	238	252
660	counting_48	counting	images/counting/counting_48.jpg	Please check all the intersections (crossing points) on this chessboard and calculate the total number.	D	298	256	284	270
661	counting_49	counting	images/counting/counting_49.jpg	Please check all the intersections (crossing points) on this chessboard and calculate the total number.	D	284	298	256	270
662	counting_50	counting	images/counting/counting_50.jpg	Please check all the intersections (crossing points) on this chessboard and calculate the total number.	C	298	256	270	284
663	counting_51	counting	images/counting/counting_51.jpg	This image shows a flock of white sheep grazing in a foggy pasture. The visibility is significantly reduced due to heavy fog, making some sheep in the background appear faded and blurred. The sheep are scattered across the green field with some standing and others lying down. How many sheep are in this pasture?	B	44	38	28	32
664	counting_52	counting	images/counting/counting_52.jpg	Please check all the intersections (crossing points) on this chessboard and calculate the total number.	A	240	270	225	255
666	counting_53	counting	images/counting/counting_53.jpg	Please count the total number of peanuts in this black and white image.	B	184	156	142	170
667	counting_54	counting	images/counting/counting_54.jpg	This image shows a wooden tray filled with fresh bright orange tangerines. The tangerines are densely packed with some overlapping, and many have dark green leaves attached to their stems. The tray is dark brown wood, and the lighting creates highlights and shadows on the fruits. How many tangerines are in the tray?	A	30	24	20	36
668	counting_55	counting	images/counting/counting_55.jpg	This image shows three round bamboo steamers filled with steamed dumplings (siu mai). Each steamer contains multiple light-colored dumplings arranged in rows. The dumplings have pleated edges and a brownish filling with green peas on top. They are placed on white perforated liners inside the bamboo steamers. How many dumplings are in total across all three steamers?	D	22	40	28	34
669	counting_56	counting	images/counting/counting_56.jpg	Please count the total number of peanuts in this image.	A	156	142	170	184
670	counting_57	counting	images/counting/counting_57.jpg	Please count the total number of peanuts in this image.	B	184	156	142	170
671	counting_58	counting	images/counting/counting_58.jpg	Please count the number of birds flying in the sky in this surveillance camera footage. The image contains severe noise, film grain, JPEG compression artifacts, and glitch effects. Please carefully identify all bird targets and count them. Options:	D	174	169	181	177
673	counting_59	counting	images/counting/counting_59.jpg	This image shows freshly steamed white buns (baozi or mantou) arranged densely on a metal steaming rack. The buns are round and plump with soft, slightly wrinkled surfaces. Steam is visible rising from the buns, creating a hazy effect. The buns are packed closely together in rows, with many touching or slightly overlapping. How many buns are in this image?	D	35	40	54	47
674	counting_60	counting	images/counting/counting_60.jpg	This image shows a school of dark blue fish swimming over a sandy seabed with some coral rock structures. The fish are mostly clustered together, with some overlapping, and there is distinct contrast between the fish and the sand. How many fish are visible in the scene?	A	17	12	14	20
676	counting_61	counting	images/counting/counting_61.jpg	This aerial image shows a parking lot from a bird's-eye view. The lot has white parking lines on gray asphalt, and numerous vehicles of various colors (black, white, red, blue, gray) are parked in organized rows. A bright sun flare is visible in the top-left corner. How many vehicles are in this parking lot?	C	25	20	31	37
677	counting_62	counting	images/counting/counting_62.jpg	This image shows a row of teal/turquoise colored electric scooters parked in a line on a brick pavement. The scooters have distinctive turquoise frames, fenders, and wheel covers with black seats and handlebars. They are neatly arranged side by side at a sharing station. How many electric scooters are in this image?	A	14	8	18	10
678	counting_63	counting	images/counting/counting_63.jpg	This underwater image depicts a school of bright yellow fish swimming over a rocky seabed. The water is slightly turbid, creating a blue haze. The fish are clustered, with some overlapping one another. How many fish are in the picture?	B	53	47	42	39
679	counting_64	counting	images/counting/counting_64.jpg	This image shows a row of blue shared bicycles (HelloRide brand) parked in a line. The bikes have distinctive blue frames, wheels, and baskets with white accents. They are neatly arranged side by side at a bike-sharing station. How many bicycles are in this image?	D	17	9	7	13
680	counting_65	counting	images/counting/counting_65.jpg	This image captures a massive school of silver fish with yellow fins swimming in the open blue ocean. The fish are scattered across the frame, varying in size due to distance and perspective, with significant overlapping in denser areas. How many fish are in the picture?	C	230	195	213	180
681	counting_66	counting	images/counting/counting_66.jpg	This image shows ripe red plums hanging on tree branches surrounded by green leaves. The plums have a deep red/purple color with a glossy surface. Some plums are clustered together while others hang individually among the foliage. How many plums are visible in this image?	A	13	7	9	17
682	counting_67	counting	images/counting/counting_67.jpg	This image depicts a scattered school of fish with distinct black vertical stripes swimming over a textured rocky reef. The fish vary significantly in size due to perspective, and the complex background adds difficulty to the counting task. How many fish are in the picture?	D	50	71	55	63
684	counting_68	counting	images/counting/counting_68.jpg	This underwater image shows a school of long, slender, silver fish (resembling barracudas) swimming in formation against a deep blue background. The fish vary in visibility, with some clearly defined in the foreground and others fading into the distance. How many fish are in the picture?	B	35	44	52	38
683	counting_69	counting	images/counting/counting_69.jpg	This image features a school of yellow striped fish swimming over a rocky reef background. The fish are bright yellow with distinct horizontal stripes and are gathered in a loose school, with some overlapping. The background consists of blue water and greyish rocks. How many fish are in the picture?	B				
686	counting_70	counting	images/counting/counting_70.jpg	This image shows a school of dark blue fish swimming over a light sandy seabed scattered with rocks. The high contrast aids visibility, though some fish overlap. How many fish are visible in the scene?	C	25	15	21	18
687	counting_71	counting	images/counting/counting_71.jpg	This image displays a school of yellow-finned fish swimming above a coral reef in clear blue water. The fish are loosely grouped, with some overlapping, making counting moderately challenging. How many fish are in the picture?	B	105	122	138	115
688	counting_72	counting	images/counting/counting_72.jpg	This image shows a large collection of watermelons arranged on the ground. The watermelons vary in color from dark green to light green with stripes, and there are also a few yellow melons mixed in. They are densely packed in rows with some touching each other. How many melons are in this image?	D	115	105	143	129
689	counting_73	counting	images/counting/counting_73.jpg	This image shows a branch of an apple tree with ripe apples hanging from it. The apples have a red-yellow coloration and are surrounded by green leaves against a light gray sky background. Some apples are clustered together while others hang individually. How many apples are on the branch?	A	11	14	6	8
692	counting_74	counting	images/counting/counting_74.jpg	This aerial image shows a snowy parking lot from a bird's-eye view during a snowstorm. Vehicles are covered with snow and snowflakes are falling, creating visual noise. The white parking lines are partially visible through the snow. Vehicles of various colors are parked in marked spaces with some empty spots. Green landscaping islands and crosswalk markings are visible through the snow cover. How many vehicles are in this parking lot?	B	96	83	70	65
693	counting_75	counting	images/counting/counting_75.jpg	This image displays a large, diverse group of people posing for a photograph against a white background. The individuals are arranged in multiple rows and are packed closely together, making counting require careful attention to each face. How many people are in the picture?	A	33	25	29	38
694	counting_76	counting	images/counting/counting_76.jpg	This image captures a dense crowd of spectators at a sporting event, many wearing New England Patriots gear and sunglasses. The fans are seated in stadium rows, creating layers of overlapping faces and bodies, which makes counting individual people challenging. How many people are in the picture?	A	47	55	38	40
695	counting_77	counting	images/counting/counting_77.jpg	This image shows a packed crowd of spectators at a stadium, mostly wearing dark winter clothing and jackets. Many individuals are clapping or watching intently. The crowd is dense with multiple rows visible, leading to overlapping figures. How many people are in the picture?	B	50	60	55	70
696	counting_78	counting	images/counting/counting_78.jpg	This image captures a group of schoolchildren and adults walking in a line through dense fog or smog. They are dressed in winter clothing, with many wearing bright colored jackets. The visibility drops off sharply in the background, making distant figures hard to see. How many people are in the picture?	C	80	61	73	67
697	counting_79	counting	images/counting/counting_79.jpg	This image shows a scene with heavy fog obscuring visibility. Several pedestrians are walking through the mist, appearing as silhouettes of varying clarity. How many people are visible in the scene?	D	13	7	11	9
698	counting_80	counting	images/counting/counting_80.jpg	This aerial image shows a foggy parking lot from a bird's-eye view. The visibility is reduced due to fog, but vehicles and white parking lines are still visible. Multiple vehicles of various colors are scattered across the parking sections with many empty spaces. Green landscaping islands and crosswalk markings are visible. How many vehicles are in this parking lot?	C	69	91	83	75
699	counting_81	counting	images/counting/counting_81.jpg	This image captures a crowd of enthusiastic fans at a sporting event during a heavy snowstorm. The falling snow creates significant visual noise ('salt and pepper' noise), and the fans are bundled in thick winter gear with hoods, making individual identification challenging. How many people are in the picture?	D	45	63	58	51
700	counting_82	counting	images/counting/counting_82.jpg	This aerial image shows a parking lot from a bird's-eye view with vehicles scattered across multiple parking sections. White parking lines and directional arrows are clearly visible on the gray asphalt. The lot has many empty spaces mixed with occupied ones. Vehicles of various colors including white, black, blue, yellow, and red are present. Green landscaping islands are visible at the edges. How many vehicles are in this parking lot?	A	83	69	76	91
701	counting_83	counting	images/counting/counting_83.jpg	This aerial image shows a large parking lot from a bird's-eye view with vehicles arranged in four distinct sections separated by driving lanes with arrow markings. Multiple vehicles of various colors including white, black, red, blue, and silver are parked in marked spaces. Green trees line the edges and separate the parking sections. The lot appears well-organized with clear white parking line markings. How many vehicles are in this parking lot?	B	140	145	135	150
702	counting_84	counting	images/counting/counting_84.jpg	This aerial image shows a parking lot from a bird's-eye view. Multiple vehicles of various colors including white, black, red, blue, and silver are parked in marked parking spaces arranged in neat rows. White parking lines clearly delineate each space. A blue car appears to be in the process of parking or leaving. The parking lot has a mix of sedans, SUVs, and vans. How many vehicles are in this parking lot?	D	56	48	71	64
705	counting_85	counting	images/counting/counting_85.jpg	This aerial image shows an urban intersection from a bird's-eye view. Multiple vehicles including cars and vans are visible on the roads, some waiting at traffic lights and others moving through the intersection. The road markings and lane divisions are clearly visible. How many vehicles are in the picture?	A	22	26	18	15
59	math_1	math	images/math/math_1.jpg	Please find the smallest square in the picture and calculate its area (round to an integer, calculated in pixels).	D	44100	42025	38025	40000
60	math_2	math	images/math/math_2.jpg	What is the sum of the interior angles of the polygon in the picture?	1800				
61	math_3	math	images/math/math_3.jpg	Solve the math problem in the diagram.	540				
62	math_4	math	images/math/math_4.jpg	Calculate the sum of the interior angles of all polygons in the diagram.	1620				
63	math_5	math	images/math/math_5.jpg	Please identify the coordinates of all the scattered points in the figure and fit the function (y = ax + c) that best matches the trend. Which of the following options is closest to the value of the coefficient a?	C	1.5	0.8	1.2	1
64	math_6	math	images/math/math_6.jpg	Solve the math problem in the diagram.	180				
65	math_7	math	images/math/math_7.jpg	Solve the math problem in the picture.	230				
66	math_8	math	images/math/math_8.jpg	Solve the math problem in the picture.	160				
67	math_9	math	images/math/math_9.jpg	Solve the math problem in the picture.	60				
68	math_10	math	images/math/math_10.jpg	Solve the math problem in the picture.	140				
258	math_11	math	images/math/math_11.jpg	Please calculate the area of the smallest orange hexagon in the image, expressed in integer pixels.	50922				
259	math_12	math	images/math/math_12.jpg	Please calculate the area of the smallest triangle that can enclose the complete triangular region represented by black dots in the image, expressed in integer pixels.	28157				
260	math_13	math	images/math/math_13.jpg	Please calculate the number of black dots in the complete triangular region represented by black dots in the image.	45				
261	math_14	math	images/math/math_14.jpg	Please calculate the number of edges of the shape in the image.	54				
262	math_15	math	images/math/math_15.jpg	Please detect the edges of the polyhedron in the image and calculate the number of edges (the image is blurry and noisy, so noise removal and contrast enhancement are required first). Options:	B	8	7	5	9
263	math_16	math	images/math/math_16.jpg	Please detect the edges of the polyhedron in the image and calculate the number of edges (the image is slightly blurred and needs to be processed first). Options:	A	9	8	10	7
264	math_17	math	images/math/math_17.jpg	How many more blue circles are there than green circles in the image? Options:	D	6	8	2	4
265	math_18	math	images/math/math_18.jpg	How many more green circles are there than red circles in the image? Options:	B	0	1	3	2
266	math_19	math	images/math/math_19.jpg	How many more red circles are there than blue circles in the image? Options:	C	3	4	1	2
267	math_20	math	images/math/math_20.jpg	How many more blue circles are there than green circles in the image? Options:	A	1	3	2	0
268	math_21	math	images/math/math_21.jpg	How many more blue circles are there than red circles in the image? Options:	B	2	8	4	6
269	math_22	math	images/math/math_22.jpg	Please calculate the number of edges of the polygon in the image. Options:	A	20	22	18	24
270	math_23	math	images/math/math_23.jpg	Please calculate the number of edges of the polygon in the image. Options:	D	28	24	26	30
271	math_24	math	images/math/math_24.jpg	Please calculate the number of edges of the polygon in the image. Options:	C	45	35	40	30
272	math_25	math	images/math/math_25.jpg	Please calculate the number of edges of the polygon in the image. Options:	D	40	55	45	50
273	math_26	math	images/math/math_26.jpg	Which shape in the image has the largest area? Options:	B	Yellow circle	Yellow square	Purple circle	Blue pentagon
274	math_27	math	images/math/math_27.jpg	What is the approximate area of the purple square (in pixels)? Options:	A	6600	6500	6400	6700
275	math_28	math	images/math/math_28.jpg	How many more quadrilaterals are there than circles in the image? Options:	C	2	4	3	1
276	math_29	math	images/math/math_29.jpg	How many more red shapes are there than green shapes? Options:	D	2	3	4	1
277	math_30	math	images/math/math_30.jpg	What is the area of the red cross (in pixels)? Options:	C	10000	9500	10500	9000
278	math_31	math	images/math/math_31.jpg	How many more yellow shapes are there than green shapes? Options:	B	1	0	3	2
279	math_32	math	images/math/math_32.jpg	What is the angle of inclination of the purple arrow relative to the horizontal direction? Options:	A	120 degrees	110 degrees	115 degrees	125 degrees
280	math_33	math	images/math/math_33.jpg	What is the difference in area (in pixels) between the largest blue shape and the largest red shape? Options:	D	55000	54000	55500	54500
281	math_34	math	images/math/math_34.jpg	How many green circles are in the picture? Options:	C	4	6	2	8
282	math_35	math	images/math/math_35.jpg	How many more blue shapes are there than green shapes in the picture? Options:	B	14	12	10	8
283	math_36	math	images/math/math_36.jpg	What is the sum of the interior angles of the polygon in the picture? Options:	A	3060	3240	2700	2880
284	math_37	math	images/math/math_37.jpg	What is the distance from point P to line l? Options:	D	135	125	140	130
285	math_38	math	images/math/math_38.jpg	How many sides does the polygon in the picture have? Options:	C	13	12	14	11
286	math_39	math	images/math/math_39.jpg	What is the length of the branch in feet? Options:	A	3	2.5	3.5	2
287	math_40	math	images/math/math_40.jpg	What is the length of the thin line in feet? Options:	B	7.5	7	7.75	7.25
288	math_41	math	images/math/math_41.jpg	What is the sum of the interior angles of the polygon in the picture? Options:	A	1620	1440	1080	1260
289	math_42	math	images/math/math_42.jpg	What is the total sum of the interior angles of all the polygons in the picture? Options:	D	1980	2340	1800	2160
290	math_43	math	images/math/math_43.jpg	For a circle centered on line r and passing through points A and B, what is the length of the circular arc with AB as the chord length? Options:	C	191.2	187.6	184.5	193.1
536	math_44	math	images/math/math_44.jpg	Please calculate the number of edges in the figure?	C	57	56	54	55
537	math_45	math	images/math/math_45.jpg	Calculate how many connected regions are inside the figure in the picture?	B	33	32	34	31
538	math_46	math	images/math/math_46.jpg	Calculate the total number of triangles in the picture?	D	42	39	40	41
539	math_47	math	images/math/math_47.jpg	Please calculate the sum of the interior angles of the geometric figure in the picture?	1080				
540	math_48	math	images/math/math_48.jpg	Provide the answer to the question in the picture.	64*$\sqrt{3} $				
541	math_49	math	images/math/math_49.jpg	Find the distance between point P and point Q on the diagram.	A	40.7	40.1	38.6	39.5
542	math_50	math	images/math/math_50.jpg	Find the distance between the two farthest points on the diagram.	C	34.0	33.4	32.5	34.6
543	math_51	math	images/math/math_51.jpg	Find the distance between the two closest points on the diagram.	B	1.4	1.6	1.8	2.0
544	math_52	math	images/math/math_52.jpg	Find the area of the triangle formed by three points on the diagram?	10				
545	math_53	math	images/math/math_53.jpg	Find the distance from point P to the straight line EF in the diagram.	A	1.22	1.02	1.32	1.12
546	math_54	math	images/math/math_54.jpg	Find the radius of the circle passing through point AB with its center on the straight line CD in the diagram.	D	7.85	7.55	8.15	8.45
547	math_55	math	images/math/math_55.jpg	Find the distance from point P to the straight line EF in the diagram.	C	7.19	7.39	7.09	7.29
548	math_56	math	images/math/math_56.jpg	Find the radius of the circle passing through point AB with its center on the straight line CD in the diagram.	A	5.13	5.33	5.23	5.03
549	math_57	math	images/math/math_57.jpg	Find the distance from point P to the straight line EF in the diagram.	D	3.63	3.83	3.43	3.23
550	math_58	math	images/math/math_58.jpg	Find the radius of the circle passing through point AB with its center on the straight line CD in the diagram.	B	6.87	6.67	7.07	6.47
551	math_59	math	images/math/math_59.jpg	Find the distance from point P to the straight line EF in the diagram.	C	0.78	1.18	0.58	0.98
552	math_60	math	images/math/math_60.jpg	Find the radius of the circle passing through point AB with its center on the straight line CD in the diagram.	D	4.30	4.70	4.50	4.10
553	math_61	math	images/math/math_61.jpg	Find the radius of the circle passing through point AB with its center on the straight line CD in the diagram.	A	5.22	5.42	5.02	4.82
554	math_62	math	images/math/math_62.jpg	Find the distance from point P to the straight line EF in the diagram.	C	4.97	4.57	4.37	4.77
555	math_63	math	images/math/math_63.jpg	Find the radius of the circle passing through points A and B, with its center on the line CD.	B	8.50	7.90	8.10	8.30
556	math_64	math	images/math/math_64.jpg	Find the distance from point P to the line EF in the figure.	D	9.14	8.94	8.74	9.34
557	math_65	math	images/math/math_65.jpg	As shown in the figure, in rectangle ABCD, AB = 10, BC = 4, E is a moving point on side BC, then the minimum value of AE + ED is ____.	20.4				
558	math_66	math	images/math/math_66.jpg	In right triangle △ABC, ∠C = 90°, AC = 4, BC = 8, then the sine value of ∠A is ____, and the radius of the inscribed circle is ____.	0.894, 1.53				
559	math_67	math	images/math/math_67.jpg	In right triangle △ABC, ∠C = 90°, AC = 8, BC = 10, then the sine value of ∠A is ____, and the radius of the inscribed circle is ____.	0.781, 2.6				
560	math_68	math	images/math/math_68.jpg	In the rectangular coordinate plane, A(3,3) and B(6,-1), the equation of the perpendicular bisector of line segment AB is ____________.	y=0.75x-2.38				
561	math_69	math	images/math/math_69.jpg	As shown in the figure, in rectangle ABCD, AB = 12, BC = 4, E is a moving point on side BC, then the minimum value of AE + ED is ____.	24.33				
562	math_70	math	images/math/math_70.jpg	Given that the side length of rhombus ABCD is 8 cm and one diagonal is 6 cm, then the length of the other diagonal is ____ cm, and the area of the rhombus is ____ cm².	14.83, 44.5				
563	math_71	math	images/math/math_71.jpg	In the rectangular coordinate plane, A(2,5) and B(8,2), the equation of the perpendicular bisector of line segment AB is ____________.	y=2x-6.5				
564	math_72	math	images/math/math_72.jpg	As shown in the figure, in rectangle ABCD, AB = 10, BC = 8, E is a moving point on side BC, then the minimum value of AE + ED is ____.	21.54				
565	math_73	math	images/math/math_73.jpg	The base radius of a cone is 4 cm, and the slant height is 8 cm. Then the height of the cone is ____ cm, the volume is ____ cm³, and the lateral surface area is ____ cm².	6.93, 116.08, 100.53				
566	math_74	math	images/math/math_74.jpg	In the Cartesian coordinate plane, A(5,5) and B(7,1), the equation of the perpendicular bisector of line segment AB is ____________.	y=0.50x+0.00				
567	math_75	math	images/math/math_75.jpg	In the Cartesian coordinate plane, A(3,2) and B(10,2), the equation of the perpendicular bisector of line segment AB is ____________.	x=6.5				
568	math_76	math	images/math/math_76.jpg	The base radius of a cone is 6 cm, and the slant height is 8 cm. Then the height of the cone is ____ cm, the volume is ____ cm³, and the lateral surface area is ____ cm². (Take π as 3.14)	5.29, 199.48, 150.8				
569	math_77	math	images/math/math_77.jpg	In the Cartesian coordinate plane, A(1,5) and B(9,1), the equation of the perpendicular bisector of line segment AB is ____________.	y=2.00x-7.00				
570	math_78	math	images/math/math_78.jpg	In △ABC, D and E are on AB and AC respectively, and DE ∥ BC. Given that AD = 7 cm, DB = 2 cm, and AE = 7 cm, then EC = ____ cm.	2.0				
